{
  "session_id": "ses_01J8Z9K2QF7X3M4N5P6R7S8T9V",
  "locale": "ja",
  "kind": "new",
  "max_seconds": 300,
  "photo_summary": "円と直線の位置関係の問題。(1)は交点の個数を求めている。",
  "problem_text": "円 x^2 + y^2 = 5 と直線 y = x + k について、(1) 共有点の個数を求めよ。(2) 接するときの k の値を求めよ。",
  "visible_work": "- 中心と直線の距離を求めている\n- (2)では連立して判別式を使っている",
  "question_seeds": "- 方法を変えた理由\n- 判別式で何がわかるのか",
  "allowed_topics": "- M2-ZUKEI-ENCHOKU — 数学II / 図形と方程式 / 円と直線の位置関係\n    - 中心と直線の距離dと半径rの比較で位置関係を判定できる",
  "allowed_topic_ids": ["M2-ZUKEI-ENCHOKU", "M1-NIJI-HANBETSU"],
  "is_premium": false
}
